{
  "schemaVersion": "0.1.0",
  "contentVersion": "trip-2026.10-v1",
  "tripKey": "missione-italia-2026-10",
  "status": "foundation-ready-not-frozen",
  "generatedAt": "2026-09-30T12:00:00+02:00",
  "minimumAppVersion": "0.1.0",
  "minimumStorageVersion": 1,
  "calendarAuthority": "planning/TRIP_CALENDAR.md",
  "sourceRegister": "public/content/sources.json",
  "rewardRegister": "public/content/rewards.json",
  "assetRegister": "public/content/assets.json",
  "locales": {"default": "en", "phraseLayer": ["it"]},
  "privacy": {"childIdentifiers": "nicknames-only", "childAccounts": false},
  "dependencies": {"deviceMode": "one-parent-phone", "gps": false, "audio": false, "tickets": false, "liveData": false},
  "excludedContent": ["gardaland"],
  "epilogueMissionId": "RETURN-EP",
  "narrative": {
    "opening": {
      "storyBeat": "Hello, explorers. I am Bussola, a small compass with a wobbly needle. Four travel powers—Curiosity, Wonder, Creativity, and Teamwork—have slipped from my points. No villain took them; I simply forgot how to notice. On this trip, three different eyes can help me remember. Every safe clue counts, and a grown-up may save or skip any clue.",
      "youngestAction": "The youngest explorer taps Wake Bussola.",
      "familyOath": "We stay together, look kindly, and let every explorer help. We stop when an adult says stop. Different clues, same team.",
      "tutorialSteps": [
        "Meet Bussola and wake the compass.",
        "Choose or swap Spotter, Detective, and Navigator.",
        "Look up together, then let the parent confirm, save, or skip."
      ]
    },
    "states": {
      "interrupted": "Clue paused. Bussola will hold your place while the family does what it needs.",
      "resume": "Welcome back. Your clue is waiting exactly where you left it.",
      "skip": "Clue saved. Nobody is left behind.",
      "manual": "A grown-up confirmed this clue. Your team can keep moving.",
      "retry": "Try a different clue—or save this one.",
      "offline": "Bussola is offline, but every mission and fallback still works.",
      "closedVenue": "The place is closed. Use the outside or card version; entry is never required.",
      "tiredLegs": "Tired legs choose the short, seated, or manual version. That still counts.",
      "badWeather": "Weather changed the route, not the team. Choose the sheltered, indoor, or card version.",
      "endingWithSkips": "Every journey has different clues. Your team brought the compass home.",
      "endingAllObserved": "You noticed every planned clue, and all four compass powers are glowing.",
      "mondaySilent": "No story opens on Monday. Bussola rests and resumes on Tuesday."
    }
  },
  "chapters": [
    {
      "id": "road",
      "order": 1,
      "dateRange": ["2026-10-04", "2026-10-04"],
      "title": "The Wobbly Needle",
      "power": "curiosity",
      "status": "fixed",
      "missionIds": ["ROAD-01", "ROAD-02", "ROAD-03"],
      "openingBeat": "Bussola can still point north, but its Curiosity point is dim. Before the car moves, the parent opens three seated clues. The children will notice change, pattern, and kind words while the driver keeps eyes on the road.",
      "closingBeat": "Country clues, safe patterns, and five kind words click into one compass point. Curiosity is glowing; Bussola sleeps through Monday and waits for Tuesday's city of water."
    },
    {
      "id": "venice",
      "order": 2,
      "dateRange": ["2026-10-06", "2026-10-06"],
      "title": "The City That Floats",
      "power": "wonder",
      "status": "fixed",
      "missionIds": ["VEN-01", "VEN-02", "VEN-03", "VEN-04"],
      "openingBeat": "Bussola wakes in a city where boats do street jobs and stone paths cross water. Wonder will return only if the team looks for a lion, reads a bridge, compares boats, and makes one quiet listening stop.",
      "closingBeat": "The winged lion, bridge pattern, working boats, and quiet clue show four ways to read Venice. Wonder glows without anyone needing to hurry, enter a venue, or stand near an edge."
    },
    {
      "id": "lagoon-islands",
      "order": 3,
      "dateRange": ["2026-10-07", "2026-10-07"],
      "title": "The Maker Islands",
      "power": "creativity",
      "status": "fixed",
      "missionIds": ["ISL-01", "ISL-02", "ISL-03"],
      "openingBeat": "Bussola's brass face has gone blank. Murano and Burano hold maker clues in glass shapes, travel symbols, bright homes, and lace stories. The family must notice respectfully and invent a pattern of its own.",
      "closingBeat": "A glass pattern, a parent-led lagoon route, and three clearly labelled Burano stories fill Bussola's face. Creativity glows because the team copied nothing fragile and made something new together."
    },
    {
      "id": "verona",
      "order": 4,
      "dateRange": ["2026-10-08", "2026-10-09"],
      "title": "The Teamwork City",
      "power": "teamwork",
      "status": "fixed",
      "missionIds": ["VER-01", "VER-02", "VER-03", "VER-04", "VER-05", "VER-06"],
      "openingBeat": "Bussola reaches Verona with Curiosity, Wonder, and Creativity awake, but its needle pulls three ways. Roman arches, a famous literary tradition, the Adige, and whichever Friday route the parent chooses will test how three roles become one team.",
      "closingBeat": "The family combines different discoveries instead of chasing a perfect route. Teamwork aligns the four compass points, and every completed, manual, or saved clue belongs to the same adventure."
    }
  ],
  "excursionSelection": {
    "status": "tbc",
    "selectedPairId": null,
    "recommendedPairId": "sigurta-borghetto",
    "thursdayShortTrip": {
      "status": "tbc",
      "recommendation": "none",
      "rule": "Any Thursday car outing replaces the VER-03 afternoon block; it is never added as another scored mission."
    },
    "candidatePairs": [
      {
        "id": "sigurta-borghetto",
        "label": "Sigurtà + Borghetto",
        "status": "candidate-recommended",
        "morningVariantId": "sigurta-team-maze",
        "afternoonVariantId": "borghetto-water-mill",
        "reason": "One nearby cluster with active garden play, a long lunch break, and a compact village walk."
      },
      {
        "id": "sirmione-lazise",
        "label": "Sirmione + Lazise",
        "status": "candidate-alternate",
        "morningVariantId": "sirmione-castle-water",
        "afternoonVariantId": "lazise-bonus-spotter",
        "reason": "Lake and castle scenery, with more parking and walking load; Lazise stays optional and low-pressure."
      },
      {
        "id": "verona-rain",
        "label": "Verona indoor fallback",
        "status": "weather-fallback",
        "morningVariantId": "verona-natural-history",
        "afternoonVariantId": "verona-childrens-museum",
        "reason": "Use for heavy rain or severe-weather closure; Children's Museum requires a parent booking check."
      }
    ]
  },
  "missions": [
    {
      "id": "ROAD-01",
      "order": 1,
      "chapterId": "road",
      "date": "2026-10-04",
      "scored": true,
      "title": "Country Detective",
      "status": "fixed",
      "durationMinutes": 8,
      "energy": "low",
      "storyBeat": "Bussola's first Curiosity cards have tumbled out of order. From their seats, the explorers can help without watching the phone. The parent will announce a safe clue—a flag, a language, or a sign—after the family reaches a new country. The Spotter notices, the Detective compares, and the Navigator orders the cards. Two clues are enough to steady the needle.",
      "objective": "Notice two parent-chosen country clues while safely seated.",
      "location": {"mode": "parent-selected", "label": "Moving car for children; parent setup before departure or at a safe stop", "coordinates": null},
      "roles": [
        {"role": "spotter", "action": "Point to a flag, language, or road-sign clue chosen by the parent."},
        {"role": "detective", "action": "Say one way the two clues differ."},
        {"role": "navigator", "action": "Place the parent-announced country cards in order."}
      ],
      "choices": [],
      "facts": [{"label": "OUR STORY", "text": "Curiosity wakes when the team notices change together.", "sourceId": null}],
      "completion": {"mode": "team-confirm", "allowedStates": ["completed", "manual", "skipped"], "retryLine": "Look for one parent-chosen clue, or use the country cards.", "explanation": "Flags, words, and sign styles can change across borders. The parent names the country; the children only compare visible clues.", "successLine": "First border clue saved—Curiosity is waking."},
      "fallbacks": {"noGps": "Parent names the current country; no automatic border detection.", "closedVenue": "Not applicable; use printed/offline country cards.", "badWeather": "Use signs seen through the window or offline cards.", "tiredLegs": "Complete fully seated or manually."},
      "safety": ["Parent starts before driving or at a safe stop.", "Driver: no screen; everyone stays buckled."],
      "reward": {"stamp": "eagle-eye", "power": "curiosity"},
      "sourceIds": [],
      "fact_checked_on": "2026-09-29",
      "review_after": "2026-10-03",
      "offlineCritical": true,
      "dependencies": {"gps": false, "audio": false, "ticket": false, "liveData": false}
    },
    {
      "id": "ROAD-02",
      "order": 2,
      "chapterId": "road",
      "date": "2026-10-04",
      "scored": true,
      "title": "Alpine Tunnel Hunt",
      "status": "fixed-route-neutral",
      "durationMinutes": 10,
      "energy": "low",
      "storyBeat": "Bussola's needle is blinking in a dark-light rhythm. The route might include a tunnel, but the app never guesses which road the family takes. If the parent announces a tunnel, the Spotter signals the start, the Detective compares dark and light, and the Navigator keeps the count. If no tunnel appears, three pattern cards solve exactly the same clue.",